"id","score","title","summary","venue","year","authors","citationCount","referenceCount","influentialCitationCount","url"
"6c761cfdb031701072582e434d8f64d436255da6",4,"AMMUS : A Survey of Transformer-based Pretrained Models in Natural Language Processing","This comprehensive survey paper explains various core concepts like pretraining, Pretraining methods, pretraining tasks, embeddings and downstream adaptation methods, presents a new taxonomy of T-PTLMs and gives brief overview of various benchmarks including both intrinsic and extrinsic.","ArXiv",2021,"Katikapalli Subramanyam Kalyan,A. Rajasekharan,S. Sangeetha",47,301,6,"https://www.semanticscholar.org/paper/6c761cfdb031701072582e434d8f64d436255da6"
"9ccad0208b50042d8378b77700146a98bd22ea3f",4,"The SIGMORPHON 2022 Shared Task on Morpheme Segmentation","","SIGMORPHON",2022,"Khuyagbaatar Batsuren,Gábor Bella,Aryaman Arora,Viktor Martinovi'c,Kyle Gorman,Zdenvek vZabokrtsk'y,A. Ganbold,vS'arka Dohnalov'a,Magda vSevvc'ikov'a,Katevrina Pelegrinov'a,Fausto Giunchiglia,Ryan Cotterell,Ekaterina Vylomova",5,81,0,"https://www.semanticscholar.org/paper/9ccad0208b50042d8378b77700146a98bd22ea3f"
"54123c8de8ecacb30ae2e9fb8c4635f4030965b5",4,"MockingBERT: A Method for Retroactively Adding Resilience to NLP Models","A novel method of retroactively adding resilience to misspellings to transformer-based NLP models without the need for re-training of the original NLP model is proposed, which significantly reduces the cost needed to evaluate a model’s resilience to adversarial attacks.","COLING",2022,"Jan Jezabek,A. Singh",0,26,0,"https://www.semanticscholar.org/paper/54123c8de8ecacb30ae2e9fb8c4635f4030965b5"
"8f248b5476666e700390f7f8ff6ca923f97d726c",3,"Advancing protein language models with linguistics: a roadmap for improved interpretability","It is argued that guidance drawn from linguistics, a field specialized in analytical rule extraction from natural language data, can aid with building more interpretable protein LMs that have learned relevant domain-specific rules.","ArXiv",2022,"Mai Ha Vu,R. Akbar,Philippe A. Robert,B. Swiatczak,V. Greiff,G. K. Sandve,Dag Trygve Tryslew Haug",3,137,0,"https://www.semanticscholar.org/paper/8f248b5476666e700390f7f8ff6ca923f97d726c"
"e5f6506f9332fcdb574f13a791e4f3c42b80ca90",3,"Demystifying Neural Language Models' Insensitivity to Word-Order","The insensitivity of natural language models to word-order is investigated by quantifying perturbations and analysing their effect on neural models’ performance on language understanding tasks in GLUE benchmark and it is found that neural language models — pretrained and non-pretrained Transformers, LSTMs, and Convolutional architectures — require local ordering more than the global ordering of tokens.","ArXiv",2021,"Louis Clouâtre,Prasanna Parthasarathi,A. Zouaq,Sarath Chandar",9,72,1,"https://www.semanticscholar.org/paper/e5f6506f9332fcdb574f13a791e4f3c42b80ca90"
"cde3d57c8f38e5dfb50edbb31faf02c23f1507fe",3,"Interpreting Character Embeddings With Perceptual Representations: The Case of Shape, Sound, and Color","This cross-lingual analysis shows that textual character representations correlate strongly with sound representations for languages using an alphabetic script, while shape correlates with featural scripts.","ACL",2022,"Sidsel Boldsen,Manex Agirrezabal,Nora Hollenstein",0,77,0,"https://www.semanticscholar.org/paper/cde3d57c8f38e5dfb50edbb31faf02c23f1507fe"
"91c3f9ed60a383f97a8c38f1e6a28a0e9be232fa",3,"Local Structure Matters Most: Perturbation Study in NLU","It is empirically shown that neural models, invariant of their inductive biases, pretraining scheme, or the choice of tokenization, mostly rely on the local structure of text to build understanding and make limited use of the global structure.","FINDINGS",2021,"Louis Clouâtre,Prasanna Parthasarathi,A. Zouaq,Sarath Chandar",4,70,0,"https://www.semanticscholar.org/paper/91c3f9ed60a383f97a8c38f1e6a28a0e9be232fa"
"9933a5af7895354087baf6c96b64dc8a8973eaed",3,"Perceiver IO: A General Architecture for Structured Inputs & Outputs","The primary focus of this work is generality, rather than speed on images, and Perceiver IO uses comparable FLOPs to attention-based image classiﬁcation models, especially for the more compact conﬂguration B pretrained on JFT.","International Conference on Learning Representations",2021,"Andrew Jaegle,Sebastian Borgeaud,Jean-Baptiste Alayrac,Carl Doersch,Catalin Ionescu,David Ding,Skanda Koppula,Andrew Brock,Evan Shelhamer,Olivier J. H'enaff,M. Botvinick,Andrew Zisserman,Oriol Vinyals,João Carreira",152,105,23,"https://www.semanticscholar.org/paper/9933a5af7895354087baf6c96b64dc8a8973eaed"
"231e768f0cd280faa0f725bb353262cb4fed08d1",3,"Hierarchical Transformers Are More Efficient Language Models","Hourglass is a hierarchical Transformer language model that sets new state-of-the-art for Transformer models on the ImageNet32 generation task and improves language modeling efﬁciency on the widely studied enwik8 benchmark.","NAACL-HLT",2021,"P. Nawrot,Szymon Tworkowski,Michal Tyrolski,Lukasz Kaiser,Yuhuai Wu,Christian Szegedy,H. Michalewski",12,38,1,"https://www.semanticscholar.org/paper/231e768f0cd280faa0f725bb353262cb4fed08d1"
"c08c2fd7b269bd9d6c1162adc3b059cdf21d40a6",3,"Lifting the Curse of Multilinguality by Pre-training Modular Transformers","This work introduces language-specific modules of their Cross-lingual Modular models from the start, which allows them to grow the total capacity of the model, while keeping the total number of trainable parameters per language constant.","North American Chapter of the Association for Computational Linguistics",2022,"Jonas Pfeiffer,Naman Goyal,Xi Victoria Lin,Xian Li,James Cross,Sebastian Riedel,Mikel Artetxe",9,69,0,"https://www.semanticscholar.org/paper/c08c2fd7b269bd9d6c1162adc3b059cdf21d40a6"
"110250df2a6ca0e0e609eaa800a21c17abeedd77",3,"NLP for Language Varieties of Italy: Challenges and the Path Forward","","ArXiv",2022,"Alan Ramponi",1,85,0,"https://www.semanticscholar.org/paper/110250df2a6ca0e0e609eaa800a21c17abeedd77"
"9af10e3d4ad1c6f8a0ff8fac8dec52703faa8e7e",2,"vTTS: visual-text to speech","Experimental results show that visual-text to speech is capable of generating speech with naturalness comparable to or better than a conventional TTS, it can transfer emphasis and emotion attributes in visual text to speech without additional labels and architectures, and it can synthesize more natural and intelligible speech from unseen and rare characters than conventional T TS.","ArXiv",2022,"Yoshifumi Nakano,Takaaki Saeki,Shinnosuke Takamichi,Katsuhito Sudoh,H. Saruwatari",2,36,1,"https://www.semanticscholar.org/paper/9af10e3d4ad1c6f8a0ff8fac8dec52703faa8e7e"
"bc39d16c108057e062ad6f1d0e8154df52cafc6a",2,"CMU’s Machine Translation System for IWSLT 2019","Block Multitask Learning (BMTL) is presented, a novel NMT architecture that predicts multiple targets of different granularities simulta- neously, removing the need to search for the optimal subword segmentation strategy.","IWSLT",2019,"Tejas Srinivasan,Ramon Sanabria,Florian Metze",3,31,0,"https://www.semanticscholar.org/paper/bc39d16c108057e062ad6f1d0e8154df52cafc6a"
"fec6def294027a2ce9094267ce7b7d57f78daf74",2,"Multitask Learning For Different Subword Segmentations In Neural Machine Translation","Block Multitask Learning (BMTL), a novel NMT architecture that predicts multiple targets of different granularities simultaneously, removing the need to search for the optimal segmentation strategy, is presented.","IWSLT",2019,"Tejas Srinivasan,Ramon Sanabria,Florian Metze",3,32,0,"https://www.semanticscholar.org/paper/fec6def294027a2ce9094267ce7b7d57f78daf74"
"debb3877b778eeb8689729d37e2b90f9f000d877",2,"Neural Machine Translation with Imbalanced Classes","This work casts neural machine translation as a classification task in an autoregressive setting and analyzes the limitations of both classification and autoregression components, and investigates the effect of class imbalance on NMT.","ArXiv",2020,"Thamme Gowda,Jonathan May",3,32,0,"https://www.semanticscholar.org/paper/debb3877b778eeb8689729d37e2b90f9f000d877"
"e6b252ad22486c10b1b288e0a5e1ad468690be70",2,"Joint Optimization of Tokenization and Downstream Model","Experimental results show that the proposed method improves the performance by determining appropriate tokenizations and can be used to explore the appropriate tokenization for an already trained model as post-processing.","Findings",2021,"Tatsuya Hiraoka,Sho Takase,Kei Uchiumi,Atsushi Keyaki,Naoaki Okazaki",11,40,0,"https://www.semanticscholar.org/paper/e6b252ad22486c10b1b288e0a5e1ad468690be70"
"8a1c54f6e2c5f1453fddb9f15e769a099286f677",2,"Domain Adaptation and Multi-Domain Adaptation for Neural Machine Translation: A Survey","This work surveys approaches to domain adaptation for NMT, particularly where a system may need to translate across multiple domains, and divides techniques into those revolving around data selection or generation, model architecture, parameter adaptation procedure, and inference procedure.","Journal of Artificial Intelligence Research",2021,"Danielle Saunders",19,366,0,"https://www.semanticscholar.org/paper/8a1c54f6e2c5f1453fddb9f15e769a099286f677"
"3fdc5601bc3294c274c5fb8e0fa7efc636c00ff2",2,"DIRE and its Data: Neural Decompiled Variable Renamings with Respect to Software Class","This work investigates how data provenance and the quality of training data affect performance, and how well, if at all, trained models generalize across software domains, and evaluates DIRE’s overall performance without respect to data quality.","ACM Transactions on Software Engineering and Methodology",2022,"Luke Dramko,Jeremy Lacomis,Pengcheng Yin,Edward J. Schwartz,Miltiadis Allamanis,Graham Neubig,Bogdan Vasilescu,Claire Le Goues",0,58,0,"https://www.semanticscholar.org/paper/3fdc5601bc3294c274c5fb8e0fa7efc636c00ff2"
"58403c6bc061670f7ce6267a3a0cd01ba1bb8e50",2,"Intérêt des modèles de caractères pour la détection d’événements (The interest of character-level models for event detection)","D’intégrer des plongements de caractères, qui peuvent capturer des informations morphologiques et de forme sur les mots, à un modèle convolutif pour la détection d’événements, évaluons deux stratégies pour réaliser une telle intégration.","JEPTALNRECITAL",2021,"Emanuela Boros,Romaric Besançon,Olivier Ferret,B. Grau",1,31,0,"https://www.semanticscholar.org/paper/58403c6bc061670f7ce6267a3a0cd01ba1bb8e50"
"2ec281d654f622da7267d7da8145e96bb77a9ede",2,"An Ensemble of Pre-trained Transformer Models For Imbalanced Multiclass Malware Classification","The experiments demonstrate that the transformer model with one transformer block layer surpass the performance of the widely used base architecture, LSTM, and BERT or CANINE, the pre-trained transformer models, outperforms in classifying highly imbalanced malware families according to evaluation metrics: F1-score and AUC score.","Computers & security",2021,"Ferhat Demirkiran,Aykut Çayir,U. Ünal,Hasan Dag",1,61,0,"https://www.semanticscholar.org/paper/2ec281d654f622da7267d7da8145e96bb77a9ede"
"e4750f7b56003fe8d2dcc750f91ddcbd7e9b82c7",2,"Checks and Strategies for Enabling Code-Switched Machine Translation","This work explores multilingual NMT models’ ability to handle code-switched text, and proposes checks to measure switching capability and investigates simple and effective data augmentation methods that can enhance an NMT model’s ability to support code- Switched text.","ArXiv",2022,"Thamme Gowda,Mozhdeh Gheini,Jonathan May",0,45,0,"https://www.semanticscholar.org/paper/e4750f7b56003fe8d2dcc750f91ddcbd7e9b82c7"
"31852f9fc732c0868af12d631c72693702d80521",2,"Text Data Augmentation for Deep Learning","The major motifs of Data Augmentation are summarized into strengthening local decision boundaries, brute force training, causality and counterfactual examples, and the distinction between meaning and form.","Journal of Big Data",2021,"Connor Shorten,T. Khoshgoftaar,B. Furht",55,134,1,"https://www.semanticscholar.org/paper/31852f9fc732c0868af12d631c72693702d80521"
"7e3081b0d698f8abf16dee626d782f3339482fe7",2,"An Assessment of the Impact of OCR Noise on Language Models","It is found that OCR noise poses a significant obstacle to language modelling, with language models increasingly diverging from their noiseless targets as OCR quality lowers, and simpler models including PPMI and Word2Vec consistently outperform transformer-based models in this respect.","International Conference on Agents and Artificial Intelligence",2022,"Konstantin Todorov,Giovanni Colavizza",1,51,0,"https://www.semanticscholar.org/paper/7e3081b0d698f8abf16dee626d782f3339482fe7"
"265ebfc1074c73917233dbecad802c0c64921a1c",2,"One does not fit all! On the Complementarity of Vision Encoders for Vision and Language Tasks","This work evaluates whether the information stored within different VEs is complementary, i.e. if providing the model with features from multiple VEs can improve the performance on a target task, and suggests that diverse VEs complement each other, resulting in improved downstream V+L task performance.","ArXiv",2022,"Gregor Geigle,Chen Liu,Jonas Pfeiffer,Iryna Gurevych",0,41,0,"https://www.semanticscholar.org/paper/265ebfc1074c73917233dbecad802c0c64921a1c"
"b162638cd42b65e6add199b0b34f1b375070fc7c",2,"Multilingual Auxiliary Tasks Training: Bridging the Gap between Languages for Zero-Shot Transfer of Hate Speech Detection Models","It is shown how hate speech detection models benefit from a cross-lingual knowledge proxy brought by auxiliary tasks fine-tuning and highlight these tasks’ positive impact on bridging the hate speech linguistic and cultural gap between languages.","AACL/IJCNLP",2022,"Syrielle Montariol,Arij Riabi,Djamé Seddah",0,56,0,"https://www.semanticscholar.org/paper/b162638cd42b65e6add199b0b34f1b375070fc7c"
"b54edea6cac055d8ff9e35c2781f5e000ebdff89",2,"Phone-ing it in: Towards Flexible Multi-Modal Language Model Training by Phonetic Representations of Data","Initial experiments using Swahili and Kinyarwanda data suggest the viability of the multi-modal approach for downstream Named Entity Recognition (NER) tasks, with models pre-trained on phone data showing an improvement of up to 6% F1-score above models that are trained from scratch.","ACL",2022,"Colin Leong,Daniel Whitenack",0,45,0,"https://www.semanticscholar.org/paper/b54edea6cac055d8ff9e35c2781f5e000ebdff89"
"66d735987a31d666a6459566ae026c40ab9a1c3a",2,"The Efficiency Misnomer","It is demonstrated how incomplete reporting of cost indicators can lead to partial conclusions and a blurred or incomplete picture of the practical considerations of different models, and suggestions to improve reporting of efficiency metrics are presented.","International Conference on Learning Representations",2021,"M. Dehghani,Anurag Arnab,L. Beyer,Ashish Vaswani,Yi Tay",31,87,3,"https://www.semanticscholar.org/paper/66d735987a31d666a6459566ae026c40ab9a1c3a"
"8f2bca9d684005675e294b33c26481e36f528cdb",2,"data2vec: A General Framework for Self-supervised Learning in Speech, Vision and Language","Data2vec is a framework that uses the same learning method for either speech, NLP or computer vision to predict latent representations of the full input data based on a masked view of the input in a self-distillation setup using a standard Transformer architecture.","International Conference on Machine Learning",2022,"Alexei Baevski,Wei-Ning Hsu,Qiantong Xu,Arun Babu,Jiatao Gu,Michael Auli",177,87,35,"https://www.semanticscholar.org/paper/8f2bca9d684005675e294b33c26481e36f528cdb"
"7016eb4f34611f97fe8c99176246e314678e03f4",2,"A New Generation of Perspective API: Efficient Multilingual Character-level Transformers","This paper presents the fundamentals behind the next version of the Perspective API from Google Jigsaw, and presents a single multilingual token-free Charformer model that is applicable across a range of languages, domains, and tasks.","KDD",2022,"Alyssa Lees,V. Tran,Yi Tay,Jeffrey Scott Sorensen,Jai Gupta,Donald Metzler,Lucy Vasserman",5,37,1,"https://www.semanticscholar.org/paper/7016eb4f34611f97fe8c99176246e314678e03f4"
"a747e8f2659df479c0092301b9658fc582423df1",2,"One Country, 700+ Languages: NLP Challenges for Underrepresented Languages and Dialects in Indonesia","An overview of the current state of NLP research for Indonesia's 700+ languages is provided and general recommendations are provided to help develop NLP technology not only for languages of Indonesia but also other underrepresented languages.","ACL",2022,"A. F. Aji,Genta Indra Winata,Fajri Koto,Samuel Cahyawijaya,A. Romadhony,Rahmad Mahendra,Kemal Kurniawan,David Moeljadi,Radityo Eko Prasojo,Timothy Baldwin,Jey Han Lau,Sebastian Ruder",4,204,0,"https://www.semanticscholar.org/paper/a747e8f2659df479c0092301b9658fc582423df1"
"cdc71d86bb0b822d73a8359338db0492a2c89b89",1,"Gated Character-aware Convolutional Neural Network for Effective Automated Essay Scoring","The experimental results show that the proposed GCCNN model outperforms the baseline deep learning models and the qualitative analysis demonstrates the importance of character-level information for tackling the out-of-vocabulary problem in grading essays.","WI/IAT",2021,"Huanyu Bai,Zhilin Huang,Anran Hao,S. C. Hui",0,26,0,"https://www.semanticscholar.org/paper/cdc71d86bb0b822d73a8359338db0492a2c89b89"
"b42e3a759348f27cca2f918a6bd0b139a5312e44",1,"A Survey of Pretrained Language Models Based Text Generation","This survey presents the recent advances achieved in the topic of PLMs for text generation and introduces three key points of applying PLMs to text generation: how to encode the input data as representations preserving input semantics which can be fused into PLMs.","ArXiv",2022,"Junyi Li,Tianyi Tang,Wayne Xin Zhao,J. Nie,Ji-rong Wen",10,237,0,"https://www.semanticscholar.org/paper/b42e3a759348f27cca2f918a6bd0b139a5312e44"
"0826af7c0f221878a142dd1681a63adb3f7e4569",1,"RoCBert: Robust Chinese Bert with Multimodal Contrastive Pretraining","RoCBert is a pretrained Chinese Bert that is robust to various forms of adversarial attacks like word perturbation, synonyms, typos, etc, and is pretrained with the contrastive learning objective which maximizes the label consistency under different synthesized adversarial examples.","ACL",2022,"Hui Su,Weiwei Shi,Xiaoyu Shen,Zhou Xiao,Tuo Ji,Jiarui Fang,Jie Zhou",2,50,0,"https://www.semanticscholar.org/paper/0826af7c0f221878a142dd1681a63adb3f7e4569"
"04bc7d5ac048133a1aaead7ab1e8021b055359c4",1,"Design principles of an open-source language modeling microservice package for AAC text-entry applications","MzoLM, an open-source language model microservice package intended for use in AAC text-entry applications, is presented, with a particular focus on the design principles of the library.","SLPAT",2022,"Brian Roark,Alexander Gutkin",0,78,0,"https://www.semanticscholar.org/paper/04bc7d5ac048133a1aaead7ab1e8021b055359c4"
"d5c2119aec38b8e8e154ec2bf0106dfac1ecc80f",1,"Building Static Embeddings from Contextual Ones: Is It Useful for Building Distributional Thesauri?","This article proposes a new method for building word or type-level embeddings from contextual models that combines the generalization and the aggregation of token representations and evaluates it for a large set of English nouns from the perspective of the building of distributional thesauri for extracting semantic similarity relations.","LREC",2022,"Olivier Ferret",1,30,0,"https://www.semanticscholar.org/paper/d5c2119aec38b8e8e154ec2bf0106dfac1ecc80f"
"abb47fb115a420fc363ed3acbd8abb1a37f0dcd5",1,"DeepREF: A Framework for Optimized Deep Learning-based Relation Classification","A new open and optimizable framework, called DeepREF, is proposed, which is inspired by the OpenNRE and REflex existing frameworks, and allows the employment of various deep learning models, to optimize their use, to identify the best inputs and to get better results with each data set for RE.","LREC",2022,"Igor Nascimento,Rinaldo Lima,Adrian-Gabriel Chifu,B. Espinasse,S. Fournier",0,34,0,"https://www.semanticscholar.org/paper/abb47fb115a420fc363ed3acbd8abb1a37f0dcd5"
"edc17c862b074fb986f9b9a144f10decb843f5fa",1,"Décontextualiser des plongements contextuels pour construire des thésaurus distributionnels (Decontextualizing contextual embeddings for building distributional thesauri )","","JEPTALNRECITAL",2022,"Olivier Ferret",0,25,0,"https://www.semanticscholar.org/paper/edc17c862b074fb986f9b9a144f10decb843f5fa"
"420c897bc67e6f438db522d919d925df1a10aa8c",1,"AMMU - A Survey of Transformer-based Biomedical Pretrained Language Models","This survey discusses core concepts of transformer-based PLMs like pretraining methods, pretraining tasks, fine-tuning methods, and various embedding types specific to biomedical domain, and introduces a taxonomy for transformerbased BPLMs.","Journal of Biomedical Informatics",2021,"Katikapalli Subramanyam Kalyan,A. Rajasekharan,S. Sangeetha",16,227,0,"https://www.semanticscholar.org/paper/420c897bc67e6f438db522d919d925df1a10aa8c"
"aeeb168feb05da1b3d31c0389e7a9196bc8970f6",1,"DravidianCodeMix: sentiment analysis and offensive language identification dataset for Dravidian languages in code-mixed text","A multilingual, manually annotated dataset for three under-resourced Dravidian languages generated from social media comments, which contains all types of code-mixing phenomena since it comprises user-generated content from a multilingual country.","Language Resources and Evaluation",2021,"Bharathi Raja Chakravarthi,R. Priyadharshini,V. Muralidaran,Navya Jose,Shardul Suryawanshi,E. Sherly,John P. McCrae",29,91,0,"https://www.semanticscholar.org/paper/aeeb168feb05da1b3d31c0389e7a9196bc8970f6"
"ec72909b75b2389efd588aa38d9c664e654d90d3",1,"Automatic Classification of Cancer Pathology Reports: A Systematic Review","This systematic review identifies the NLP systems for classifying pathology reports published between the years of 2010 and 2021 and benchmarked the systems based on methodology, complexity of the prediction task and core types of NLP models.","Journal of pathology informatics",2022,"Thiago Santos,Amara Tariq,J. Gichoya,H. Trivedi,I. Banerjee",3,66,0,"https://www.semanticscholar.org/paper/ec72909b75b2389efd588aa38d9c664e654d90d3"
"e923c415140a095711857420976b41e7a07cfe9c",1,"Towards improving the robustness of sequential labeling models against typographical adversarial examples using triplet loss","Experiments show that the proposed adversarial training framework provides better resistance against adversarial examples on all tasks, and can further improve the model’s robustness on the chunking task by including a triplet loss constraint.","Natural Language Engineering",2022,"Can Udomcharoenchaikit,P. Boonkwan,P. Vateekul",0,11,0,"https://www.semanticscholar.org/paper/e923c415140a095711857420976b41e7a07cfe9c"
"1b012686cf42baed47c11f0454b20a4d820a1db1",1,"The EMory BrEast imaging Dataset (EMBED): A Racially Diverse, Granular Dataset of 3.5M Screening and Diagnostic Mammograms","The EMory BrEast imaging Dataset (EMBED) addresses gaps by providing 3650,000 2D and DBT screening and diagnostic mammograms for 116,000 women divided equally between White and African American patients.","ArXiv",2022,"J. Jeong,B. Vey,A. Bhimireddy,Thomas Kim,Thiago Santos,R. Correa,Raman Dutt,M. Mosunjac,G. Oprea-Ilies,Geoffrey Smith,Min-Jae Woo,Christopher R. McAdams,M. Newell,I. Banerjee,J. Gichoya,H. Trivedi",1,37,0,"https://www.semanticscholar.org/paper/1b012686cf42baed47c11f0454b20a4d820a1db1"
"7746ac2e1e84c2f1d82a4593e2cdfdd4c93a04d8",1,"An open-source natural language processing toolkit to support software development: addressing automatic bug detection, code summarisation and code search","The paper focuses on the NLP tools developed and integrated in the Persistent Knowledge Monitor, namely the deep learning models developed to perform variable misuse, code summarisation and semantic parsing.","Open Research Europe",2022,"Cristian Robledo,Francesca Sallicati,G. de Chalendar,Marcos Fernández,Pablo de Castro,Eduardo Martín,Javier Gutiérrez,Yannis Bouachera",0,49,0,"https://www.semanticscholar.org/paper/7746ac2e1e84c2f1d82a4593e2cdfdd4c93a04d8"
"e4645f7d08b5bc878bd38c3db19c3b1a9978bd43",1,"Imputing Out-of-Vocabulary Embeddings with LOVE Makes LanguageModels Robust with Little Cost","A simple contrastive learning framework, LOVE, which extends the word representation of an existing pre-trained language model and makes it robust to OOV with few additional parameters, and can be used in a plug-and-play fashion with FastText and BERT, where it significantly improves their robustness.","ACL",2022,"Lihu Chen,G. Varoquaux,Fabian M. Suchanek",0,67,0,"https://www.semanticscholar.org/paper/e4645f7d08b5bc878bd38c3db19c3b1a9978bd43"
"16f0acab166e8ac756927fc8f2e8f68be641605b",1,"Signal in Noise: Exploring Meaning Encoded in Random Character Sequences with Character-Aware Language Models","It is proposed that n-grams composed of random character sequences, or garble, provide a novel context for studying word meaning both within and beyond extant language, and it is shown that meaning and primitive information are intrinsically linked.","ACL",2022,"Mark Chu,Bhargav Srinivasa Desikan,E. Nadler,Ruggerio L. Sardo,Elise Darragh-Ford,Douglas Guilbeault",0,58,0,"https://www.semanticscholar.org/paper/16f0acab166e8ac756927fc8f2e8f68be641605b"
