"id","score","title","summary","venue","year","authors","citationCount","referenceCount","influentialCitationCount","url"
"e68d1aa5e78226bb868a43842a87a5532b813b0b",1,"CancerBERT: a cancer domain-specific language model for extracting breast cancer phenotypes from electronic health records","The results validated that using customized vocabulary may further improve the performances of domain specific BERT models in clinical NLP tasks and developed and evaluated CancerBERT models to extract the cancer phenotypes in clinical notes and pathology reports.","J. Am. Medical Informatics Assoc.",2022,"Sicheng Zhou,Nan Wang,Liwei Wang,Hongfang Liu,Rui Zhang",0,33,0,"https://www.semanticscholar.org/paper/e68d1aa5e78226bb868a43842a87a5532b813b0b"
"b3b1659c992cbbd233038522ddd170887c033fe7",1,"Mixed-Phoneme BERT: Improving BERT with Mixed Phoneme and Sup-Phoneme Representations for Text to Speech","The proposed Mixed-Phoneme BERT is a novel variant of the BERT model that uses mixed phoneme and sup-phoneme representations to enhance the learning capability and achieves 3 × inference speedup and similar voice quality to the previous TTS pre-trained model PnG BERT.","INTERSPEECH",2022,"Guangyan Zhang,Kaitao Song,Xu Tan,Daxin Tan,Yuzi Yan,Yanqing Liu,G. Wang,Wei Zhou,Tao Qin,Tan Lee,Sheng Zhao",2,30,1,"https://www.semanticscholar.org/paper/b3b1659c992cbbd233038522ddd170887c033fe7"
"bff16ea31d5bc6b25b6e48327a2d7026e92a788d",1,"CharacterBERT and Self-Teaching for Improving the Robustness of Dense Retrievers on Queries with Typos","This paper shows that a small character level perturbation in queries (as caused by typos) highly impacts the effectiveness of dense retrievers, and develops dense retriever methods that are robust to such queries with typos, while still being as performant as previous methods on queries without typos.","Annual International ACM SIGIR Conference on Research and Development in Information Retrieval",2022,"Shengyao Zhuang,G. Zuccon",6,47,1,"https://www.semanticscholar.org/paper/bff16ea31d5bc6b25b6e48327a2d7026e92a788d"
"6058ce3819d72c3e429bea58d78d80c719cb4bdb",1,"Data Augmentation for Biomedical Factoid Question Answering","It is shown that DA can lead to very significant performance gains, even when using large pre-trained Transformers, contributing to a broader discussion of if/when DA benefits large pre -trained models.","BIONLP",2022,"Dimitris Pappas,Prodromos Malakasiotis,Ion Androutsopoulos",0,87,0,"https://www.semanticscholar.org/paper/6058ce3819d72c3e429bea58d78d80c719cb4bdb"
"9727fa4acdc5312ff86745875ef3db8578f153ac",1,"Decorate the Examples: A Simple Method of Prompt Design for Biomedical Relation Extraction","This paper presents a simple yet effective method to systematically generate comprehensive prompts that reformulate the relation extraction task as a cloze-test task under a simple prompt formulation, and finds prompt-based learning requires fewer training examples to make reasonable predictions.","LREC",2022,"Hui-Syuan Yeh,T. Lavergne,Pierre Zweigenbaum",0,36,0,"https://www.semanticscholar.org/paper/9727fa4acdc5312ff86745875ef3db8578f153ac"
"91141410b0bd141bc3b1ac0c190c3867181d699c",1,"Multi-task learning in under-resourced Dravidian languages","Analysis of fine-tuned models indicates the preference of multi-task learning over single task learning resulting in a higher weighted F1 score on all three languages, and this framework is applicable to other sequence classification problems irrespective to the size of the datasets.","Journal of Data, Information and Management",2022,"Adeep Hande,Siddhanth U Hegde,Bharathi Raja Chakravarthi",2,27,0,"https://www.semanticscholar.org/paper/91141410b0bd141bc3b1ac0c190c3867181d699c"
"f1d8dbe4e217d2221c5276f1e0c616ba5f82d1d3",1,"A review on Natural Language Processing Models for COVID-19 research","A range of transformer-based biomedical pretrained language models are evaluated using the BLURB benchmark and the novel T-BPLM BioLinkBERT gives groundbreaking results by incorporating document link knowledge and hyperlinking into its pretraining.","Healthcare Analytics",2022,"Karl Hall,Victor Chang,Chrisina Jayne",1,104,0,"https://www.semanticscholar.org/paper/f1d8dbe4e217d2221c5276f1e0c616ba5f82d1d3"
"305062aa036ffeafdd6300303898dff8ed59a7dc",1,"Cross-lingual Approaches for the Detection of Adverse Drug Reactions in German from a Patient’s Perspective","This work presents the first corpus for German Adverse Drug Reaction (ADR) detection in patient-generated content, consisting of 4,169 binary annotated documents from a German patient forum, and provides preliminary experiments for binary classification using different methods of zero- and few-shot learning based on a multi-lingual model.","LREC",2022,"Lisa Raithel,Philippe E. Thomas,Roland Roller,Oliver Sapina,Sebastian Moller,Pierre Zweigenbaum",0,44,0,"https://www.semanticscholar.org/paper/305062aa036ffeafdd6300303898dff8ed59a7dc"
"c75b1fb2348c0f54259319b3595ececaf1d98430",1,"Medical terminology-based computing system: a lightweight post-processing solution for out-of-vocabulary multi-word terms","This study presents MedTCS—a lightweight, post-processing module—to simplify hybridized or compound terms into regular words using medical nomenclature and demonstrates that the proposed module enables the word embedding models to generate vectors of out-of-vocabulary words effectively.","Frontiers in Molecular Biosciences",2022,"Nadia Saeed ,Hammad Naveed",0,55,0,"https://www.semanticscholar.org/paper/c75b1fb2348c0f54259319b3595ececaf1d98430"
"7c206d541552a57b4c0cfe5b5113d3cc8e31df01",1,"IMSE: interaction information attention and molecular structure based drug drug interaction extraction","A model that leverages state of the art transformer architecture in conjunction with multiple features can bolster the performances of drug drug interation tasks in the biomedical domain and would be helpful in identification of potential adverse drug reactions.","BMC Bioinform.",2022,"Biao Duan,Jing Peng,Yi Zhang",0,46,0,"https://www.semanticscholar.org/paper/7c206d541552a57b4c0cfe5b5113d3cc8e31df01"
"8f541cf5b193654d262dbdaea2b8a0d7d913e8dc",1,"Survey of NLP in Pharmacology: Methodology, Tasks, Resources, Knowledge, and Tools","This work splits the coverage into categories to survey modern NLP methodology, commonly addressed tasks, relevant textual data, knowledge bases, and useful programming libraries, and presents a comprehensive overview of the area.","ArXiv",2022,"D. Trajanov,Vangel Trajkovski,Makedonka Dimitrieva,Jovana Dobreva,Milos Jovanovik,Matej Klemen,Alevs vZagar,Marko Robnik-vSikonja",0,245,0,"https://www.semanticscholar.org/paper/8f541cf5b193654d262dbdaea2b8a0d7d913e8dc"
"8297a3b52eea4e8c3ab8e97910839b4a3b917891",1,"On the State of the Art in Authorship Attribution and Authorship Verification","It is shown that through the application of hard-negative mining, AV methods are competitive alternatives to AA methods, and on the two AA datasets with the greatest number of words per author, BERT-based models perform best.","ArXiv",2022,"Jacob Tyo,Bhuwan Dhingra,Z. Lipton",2,71,1,"https://www.semanticscholar.org/paper/8297a3b52eea4e8c3ab8e97910839b4a3b917891"
"1e2a5dca6f310241dd8a9b56873edf8ca211c781",1,"Enriching Biomedical Knowledge for Low-resource Language Through Translation","A state-of-theart translation model in English-Vietnamese is made use to translate and produce both pretrained as well as supervised data in the biomedical domains, and ViPubmedT5, a pretrained Encoder-Decoder Transformer model trained on 20 million translated abstracts from the high-quality public PubMed corpus is introduced.","bioRxiv",2022,"Long Phan,Tai Dang,Hieu Tran,Vy Phan,Lam D. Chau,Trieu H. Trinh",0,51,0,"https://www.semanticscholar.org/paper/1e2a5dca6f310241dd8a9b56873edf8ca211c781"
"247328a082d86199ed5a98e1d726aa205c1da9df",1,"Neural Machine Translation","A comprehensive treatment of the topic, ranging from introduction to neural networks, computation graphs, description of the currently dominant attentional sequence-to-sequence model, recent refinements, alternative architectures and challenges.","ArXiv",2017,"Philipp Koehn",242,425,32,"https://www.semanticscholar.org/paper/247328a082d86199ed5a98e1d726aa205c1da9df"
"0ab0fda8774c303be8f8f8c8f684a890dcf5d455",1,"Lattice-Based Transformer Encoder for Neural Machine Translation","This work proposes lattice-based encoders to explore effective word or subword representation in an automatic way during training and proposes two methods: 1) lattice positional encoding and 2) lattICE-aware self-attention to further improve translation performance.","Annual Meeting of the Association for Computational Linguistics",2019,"Fengshun Xiao,Jiangtong Li,Zhao Hai,Rui Wang,Kehai Chen",37,49,5,"https://www.semanticscholar.org/paper/0ab0fda8774c303be8f8f8c8f684a890dcf5d455"
"0aef56962035a79101821480f51897fdc4443945",1,"Character n-gram Embeddings to Improve RNN Language Models","A novel Recurrent Neural Network (RNN) language model that takes advantage of character information based on research in the field of word embedding construction and combines them with ordinary word embeddings is proposed.","AAAI",2019,"Sho Takase,Jun Suzuki,Masaaki Nagata",16,46,1,"https://www.semanticscholar.org/paper/0aef56962035a79101821480f51897fdc4443945"
"9f3f6deeb1f03ebd52f9ab44275ad382fe60d073",1,"Latent Part-of-Speech Sequences for Neural Machine Translation","A new latent variable model, LaSyn, is introduced that captures the co-dependence between syntax and semantics, while allowing for effective and efficient inference over the latent space.","EMNLP",2019,"Xuewen Yang,Yingru Liu,Dongliang Xie,Xin Wang,Niranjan Balasubramanian",10,48,2,"https://www.semanticscholar.org/paper/9f3f6deeb1f03ebd52f9ab44275ad382fe60d073"
"fac7f9b04fba4889b445e309d384644d15ee7e88",1,"Trends and Advances in Neural Machine Translation","This paper breaks down different models, approaches, inception, principle development, and structures utilized in NMT to discover a productive strategy to make a translation system and identifying the advances and imperfections of the equivalent.","2020 IEEE International Conference for Innovation in Technology (INOCON)",2020,"Purva Kulkarni,Pravina Bhalerao,Kuheli Nayek,R. Deolekar",0,24,0,"https://www.semanticscholar.org/paper/fac7f9b04fba4889b445e309d384644d15ee7e88"
"ca83469977ab49baae02ef1e12f419120927ecdc",1,"Mixed-Level Neural Machine Translation","A novel heterogeneous translation unit system, considering linguistic characteristics of the synthetic Russian language and the analytic Vietnamese language is proposed, which improves over the existing best homogeneous Russian-Vietnamese translation system by 1.17 BLEU.","Computational Intelligence and Neuroscience",2020,"Thien Nguyen,Huu Nguyen,Phuoc Tran",7,25,0,"https://www.semanticscholar.org/paper/ca83469977ab49baae02ef1e12f419120927ecdc"
"188f913be48a218b44b0bd964662b4926fd0b0b8",1,"Neural Machine Translation: A Review of Methods, Resources, and Tools","A broad review of the methods for NMT is provided and focus on methods relating to architectures, decoding, and data augmentation, with a discussion of possible future research directions.","AI Open",2020,"Zhixing Tan,Shuo Wang,Zonghan Yang,Gang Chen,Xuancheng Huang,Maosong Sun,Yang Liu",27,169,0,"https://www.semanticscholar.org/paper/188f913be48a218b44b0bd964662b4926fd0b0b8"
"bfbfeb0613beae296d76077b2adc9e38a6b678a4",1,"Sub-Subword N-Gram Features for Subword-Level Neural Machine Translation","A novel approach that combines subword-level segmentation with character-level information in the form of character n-gram features to construct embedding matrices and softmax output projections for a standard encoderdecoder model that increases the vocabulary size for small training datasets without reducing translation quality.","Journal of Natural Language Processing",2021,"A. Martinez,Katsuhito Sudoh,Yuji Matsumoto",1,36,0,"https://www.semanticscholar.org/paper/bfbfeb0613beae296d76077b2adc9e38a6b678a4"
"c68959f4da94fd35da5e8649465177b24d0dd351",1,"Byte-based Multilingual NMT for Endangered Languages","This work proposes a byte-based multilingual neural machine translation system (BMNMT), which consistently and significantly outperforms subword/word-based baselines on twelve language pairs up to +18.5 BLEU points, an 840% relative improvement.","International Conference on Computational Linguistics",2022,"Mengjiao Zhang,Jia Xu",0,24,0,"https://www.semanticscholar.org/paper/c68959f4da94fd35da5e8649465177b24d0dd351"
"2e6028f8b156c8b344e1a68d15d88403a978c71d",1,"Learning Multiscale Transformer Models for Sequence Generation","This work built a multiscale Transformer model by establishing relationships among scales based on word-boundary information and phrase-level prior knowledge and yielded consistent performance gains over the strong baseline on several test sets without sacrificing the efficiency.","ICML",2022,"Bei Li,Tong Zheng,Yi Jing,Chengbo Jiao,Tong Xiao,Jingbo Zhu",0,58,0,"https://www.semanticscholar.org/paper/2e6028f8b156c8b344e1a68d15d88403a978c71d"
"2dcdc4ef997507630f2c9b1b6682646ae31bdb7f",1,"SIT at MixMT 2022: Fluent Translation Built on Giant Pre-trained Models","This paper describes the Stevens Institute of Technology’s submission for the WMT 2022 Shared Task: Code-mixed Machine Translation (MixMT), which consisted of two subtasks, subtask 1 Hindi/English to Hinglish and subtask 2 Hinglit to English translation.","ArXiv",2022,"Abdul Rafae Khan,Hrishikesh Kanade,Girish Amar Budhrani,Preet Jhanglani,Jia Xu",0,45,0,"https://www.semanticscholar.org/paper/2dcdc4ef997507630f2c9b1b6682646ae31bdb7f"
"fbd47a815c73a83e8a47ee2ed38826c82ffc0c2a",1,"Exploring Phoneme-Level Speech Representations for End-to-End Speech Translation","This work shows that a naive method to create compressed phoneme-like speech representations is far more effective and efficient for translation than traditional frame-level speech features.","ACL",2019,"Elizabeth Salesky,Matthias Sperber,A. Black",27,33,3,"https://www.semanticscholar.org/paper/fbd47a815c73a83e8a47ee2ed38826c82ffc0c2a"
"95236a88cc959656958d7a49422f4004015d594d",1,"Comparison between NMT and PBSMT Performance for Translating Noisy User-Generated Content","It is shown that, contrary to what could be expected, PBSMT outperforms NMT when translating non-canonical inputs, and suggests new avenue for improving NMT models.","NODALIDA",2019,"José Carlos Rosales Núñez,Djamé Seddah,Guillaume Wisniewski",9,46,1,"https://www.semanticscholar.org/paper/95236a88cc959656958d7a49422f4004015d594d"
"201fae97e51fb6aea7ed8120147e806e43834de6",1,"Neural Machine Translation: A Review and Survey","This work traces back the origins of modern NMT architectures to word and sentence embeddings and earlier examples of the encoder-decoder network family and concludes with a survey of recent trends in the field.","",2019,"Felix Stahlberg",10,537,1,"https://www.semanticscholar.org/paper/201fae97e51fb6aea7ed8120147e806e43834de6"
"4d08dcd2cc1e9691defe664a10f021424a896a1e",1,"Neural Machine Translation: A Review","This work traces back the origins of modern NMT architectures to word and sentence embeddings and earlier examples of the encoder-decoder network family and concludes with a survey of recent trends in the field.","Journal of Artificial Intelligence Research",2019,"Felix Stahlberg",64,641,3,"https://www.semanticscholar.org/paper/4d08dcd2cc1e9691defe664a10f021424a896a1e"
"8ab8288e3596fecfc2c5482cc8d48c54e97ab42e",1,"Adversarial Subword Regularization for Robust Neural Machine Translation","This paper presents adversarial subword regularization (ADVSR) to study whether gradient signals during training can be a substitute criterion for exposing diverse subword segmentations and experimentally shows that the model-based adversarial samples effectively encourage NMT models to be less sensitive to segmentation errors and improve the performance of N MT models in low-resource and out-domain datasets.","FINDINGS",2020,"Jungsoon Park,Mujeen Sung,Jinhyuk Lee,Jaewoo Kang",3,47,0,"https://www.semanticscholar.org/paper/8ab8288e3596fecfc2c5482cc8d48c54e97ab42e"
"405cd5cd6e056675d4545eba12742174cc75d7e7",1,"Transfer learning and subword sampling for asymmetric-resource one-to-many neural translation","These approaches for improving neural machine translation for low-resource languages are reviewed in the context of an asymmetric-resource one-to-many translation task, in which the pair of target languages are related, with one being a very low- resource and the other a higher-resource language.","Machine Translation",2020,"Stig-Arne Grönroos,Sami Virpioja,M. Kurimo",4,114,0,"https://www.semanticscholar.org/paper/405cd5cd6e056675d4545eba12742174cc75d7e7"
"38b40ae531ddca434de07015637b78413370d15a",1,"The Roles of Language Models and Hierarchical Models in Neural Sequence-to-Sequence Prediction","It is shown how traditional symbolic statistical machine translation models can still improve neural machine translation while reducing the risk of common pathologies of NMT such as hallucinations and neologisms.","EAMT",2020,"Felix Stahlberg",3,767,0,"https://www.semanticscholar.org/paper/38b40ae531ddca434de07015637b78413370d15a"
"8bcde747a44cbc2601175301808fe4518c9128dc",1,"Optimizing Word Segmentation for Downstream Task","The proposed method, optimizing tokenization (OpTok), is trained to assign a high probability to such appropriate tokenization based on the downstream task loss, and can be used for any downstream task which uses a vector representation of a sentence such as text classification.","FINDINGS",2020,"Tatsuya Hiraoka,Sho Takase,Kei Uchiumi,Atsushi Keyaki,Naoaki Okazaki",8,38,1,"https://www.semanticscholar.org/paper/8bcde747a44cbc2601175301808fe4518c9128dc"
"6dc710b46bc510a42af487a3ac220e4fabf4d518",1,"VOLT: Improving Vocabularization via Optimal Transport for Machine Translation","An exciting relation between an information-theoretic feature and BLEU scores is found and it is found that VOLT beats widely-used vocabularies on diverse scenarios, and one advantage of VOLT lies in its low resource consumption.","ArXiv",2020,"Jingjing Xu,Hao Zhou,Chun Gan,Zaixiang Zheng,Lei Li",1,33,0,"https://www.semanticscholar.org/paper/6dc710b46bc510a42af487a3ac220e4fabf4d518"
"b086b812c867b1d07eb65bcdd206dd0891733f9d",1,"Vocabulary Learning via Optimal Transport for Neural Machine Translation","This paper proposes VOLT, a simple and efficient solution without trial training that beats widely-used vocabularies in diverse scenarios, including WMT-14 English-German translation, TED bilingual translation, and TED multilingual translation.","Annual Meeting of the Association for Computational Linguistics",2020,"Jingjing Xu,Hao Zhou,Chun Gan,Zaixiang Zheng,Lei Li",32,32,3,"https://www.semanticscholar.org/paper/b086b812c867b1d07eb65bcdd206dd0891733f9d"
"24fd022750ea88e44e6790c7c7e1923635885c71",1,"Translation Mechanism of Neural Machine Algorithm for Online English Resources","This paper proposes a framework that integrates vocabulary alignment structure for neural machine translation at the vocabulary level and uses the word alignment structure of statistical machine translation as the external vocabulary alignment information and introduces it into the decoding step of Neural machine translation.","Complex.",2021,"Yanping Ye",2,25,0,"https://www.semanticscholar.org/paper/24fd022750ea88e44e6790c7c7e1923635885c71"
"9635e3c008f7bfa80638ade7134a8fb0ef1b37e1",1,"You should evaluate your language model on marginal likelihood over tokenisations","It is argued that language models should be evaluated on their marginal likelihood over tokenisations, and it is shown that the marginal perplexity can be significantly better than the one best, especially on out-of-domain data.","EMNLP",2021,"Kris Cao,Laura Rimell",3,42,0,"https://www.semanticscholar.org/paper/9635e3c008f7bfa80638ade7134a8fb0ef1b37e1"
"b62a56f629f77acce9ea69456d67dd77de1c7dfb",1,"Clustering Monolingual Vocabularies to Improve Cross-Lingual Generalization","This work explores the idea of learning multilingual language models based on clustering of monolingual segments and shows significant improvements over standard multilingual segmentation and training across nine languages on a question answering task, both in a small model regime and for a model of the size of BERT-base.","MRL",2021,"R. Bassani,Anders Søgaard,Tejaswini Deoskar",1,79,0,"https://www.semanticscholar.org/paper/b62a56f629f77acce9ea69456d67dd77de1c7dfb"
"0d4b5c9a071557f4eb12f63f785dbc89071d4272",1,"How Good is Your Tokenizer? On the Monolingual Performance of Multilingual Language Models","It is found that replacing the original multilingual tokenizer with the specialized monolingual tokenizer improves the downstream performance of the multilingual model for almost every task and language.","Annual Meeting of the Association for Computational Linguistics",2020,"Phillip Rust,Jonas Pfeiffer,Ivan Vulic,Sebastian Ruder,Iryna Gurevych",68,102,9,"https://www.semanticscholar.org/paper/0d4b5c9a071557f4eb12f63f785dbc89071d4272"
"dca4128a33ca22c02031b5c0c28548a0df022d80",1,"BanglaBERT: Combating Embedding Barrier in Multilingual Models for Low-Resource Language Understanding","The Embedding Barrier is introduced, a phenomenon that limits the monolingual performance of multilingual models on low-resource languages having unique typologies and a straightforward solution by transcribing languages to a common script is proposed, which can effectively improve the performance of a multilingual model for the Bangla language.","",2021,"Abhik Bhattacharjee,Tahmid Hasan,Kazi Samin,Md. Saiful Islam,M. S. Rahman,Anindya Iqbal,Rifat Shahriyar",6,56,0,"https://www.semanticscholar.org/paper/dca4128a33ca22c02031b5c0c28548a0df022d80"
"2b9762e91305986ac8a2d624d0a69521304405f3",1,"XTREME-R: Towards More Challenging and Nuanced Multilingual Evaluation","This paper analyzes the current state of cross-lingual transfer learning and summarizes some lessons learned, and provides a massively multilingual diagnostic suite and fine-grained multi-dataset evaluation capabilities through an interactive public leaderboard to gain a better understanding of such models.","Conference on Empirical Methods in Natural Language Processing",2021,"Sebastian Ruder,Noah Constant,Jan A. Botha,Aditya Siddhant,Orhan Firat,Jinlan Fu,Pengfei Liu,Junjie Hu,Graham Neubig,Melvin Johnson",67,62,18,"https://www.semanticscholar.org/paper/2b9762e91305986ac8a2d624d0a69521304405f3"
"a20a802839d72bee1c85f4a1cb77addadacb2179",1,"Specializing Multilingual Language Models: An Empirical Study","These evaluations on part-of-speech tagging, universal dependency parsing, and named entity recognition in nine diverse low-resource languages uphold the viability of these approaches while raising new questions around how to optimally adapt multilingual models to low- resource settings.","MRL",2021,"Ethan C. Chau,Noah A. Smith",9,72,0,"https://www.semanticscholar.org/paper/a20a802839d72bee1c85f4a1cb77addadacb2179"
"3e53ca0f1d08e5a0f3f014af3eb59dabe95b07e5",1,"Translate & Fill: Improving Zero-Shot Multilingual Semantic Parsing with Synthetic Data","Experimental results on three multilingual semantic parsing datasets show that data augmentation with TaF reaches accuracies competitive with similar systems which rely on traditional alignment techniques.","Conference on Empirical Methods in Natural Language Processing",2021,"M. Nicosia,Zhongdi Qu,Y. Altun",9,62,2,"https://www.semanticscholar.org/paper/3e53ca0f1d08e5a0f3f014af3eb59dabe95b07e5"
"e43a360728e34e43934707665db0f7be02c8e5a7",1,"Interpreting BERT-based stance classification: a case study about the Brazilian COVID vaccination","This paper proposes a BERT-based stance classification model and an attention-based mechanism to identify the influential words for stance classification and uses these metrics to assess if words with high attention weights correspond to domain intrinsic properties and contribute to the correct classification of stances.","SBBD",2021,"Carlos Abel Córdova Sáenz,Karin Becker",2,16,0,"https://www.semanticscholar.org/paper/e43a360728e34e43934707665db0f7be02c8e5a7"
"12fec03c538c7aaeca1a4e1ab8d66aed5f793fc0",1,"reamtchka at SemEval-2022 Task 6: Investigating the effect of different loss functions for Sarcasm detection for unbalanced datasets","A voting classifier between either multiple different BERT-based models or machine learning models is proposed, as the final model in SemEval-2022 Task 6: Intended Sarcasm Detection in English and Arabic.","International Workshop on Semantic Evaluation",2022,"Reem Abdel-Salam",3,36,0,"https://www.semanticscholar.org/paper/12fec03c538c7aaeca1a4e1ab8d66aed5f793fc0"
"b1be10b76314ea8569249f2310f1e6eead8a5adc",1,"Building Domain-specific Corpora from the Web: the Case of European Digital Service Infrastructures","This paper explores the feasibility of building an automatic classifier that allows to identify which segments in a generic corpus are relevant for a particular DSI, and uses pre-trained (multilingual) language models to perform the classification.","BUCC",2022,"Rik van Noord,Cristian García-Romero,M. Esplà-Gomis,Leopoldo Pla Sempere,Antonio Toral",0,23,0,"https://www.semanticscholar.org/paper/b1be10b76314ea8569249f2310f1e6eead8a5adc"
"e11d8663ccf2cc412f408853fa5f19ebac75df54",1,"How to encode arbitrarily complex morphology in word embeddings, no corpus needed","The word embeddings in this paper are explicitly designed to be both linguistically interpretable and fully capable of handling the broad variety found in the world’s diverse set of 7000 languages, regardless of corpus size or morphological characteristics.","FIELDMATTERS",2022,"Lane Schwartz,Coleman Haley,Francis M. Tyers",0,49,0,"https://www.semanticscholar.org/paper/e11d8663ccf2cc412f408853fa5f19ebac75df54"
